{
  "scenario": "A company is reviewing its daily profit over the past month to better understand an unusual change in performance. Over the past year, the company’s profit has generally been declining, but during this month it started going up, but later began to decrease again. The company recently made a change in its marketing strategy, which may have contributed to this fluctuation. The company wants to choose a function that best models this month’s data. The goal is to identify the most important features of this month’s profit pattern so the company can decide which parts of the month deserve closer investigation.",
  "question": "Use the function \\(f(x)=-0.01x^{3}+0.45x^{2}-4x+80\\) to model the company’s profit. Analyse the company’s situation by finding its critical points.",
  "plotDataSrc": "/data/scenarios/1/plot-data.json",
  "questionParts": [
    {
      "id": "1",
      "label": "Use the function ▁▁▁▁ to model the company’s profit.",
      "options": [
        {
          "id": "f1",
          "text": "\\(f(x)=-0.01x^{3}+0.45x^{2}-4x+80\\)",
          "correct": true,
          "feedback": "Correct! This function matches the overall shape of the scatter plot and the story in the scenario. The graph starts by decreasing, then rises to a high point, and later begins decreasing again, which fits the monthly profit pattern shown in the data. The coefficients also create a smooth and realistic curve: the cubic term \\(-0.01x^3\\) is small enough to avoid overly steep changes, while the quadratic and linear terms place the turning points in a reasonable part of the month. This makes the function a strong model for identifying the key features of the company’s profit pattern."
        },
        {
          "id": "f2",
          "text": "\\(f(x)=-0.01x^{3}+0.4x^{2}-3x+90\\)",
          "correct": false,
          "feedback": "Incorrect! This function is close to the correct model, but its coefficients make the graph fit the data less accurately. The constant term \\(+90\\) shifts the graph upward, so the model starts too high compared with the early profit values in the scatter plot. Also, changing the quadratic coefficient from \\(0.45\\) to \\(0.4\\) and the linear coefficient from \\(-4\\) to \\(-3\\) changes the shape and location of the turning points. Because of these differences, the curve does not match the low point and later rise in the data as well as the correct function."
        },
        {
          "id": "f3",
          "text": "\\(f(x)=18\\sin(0.16x-2.4)+88\\)",
          "correct": false,
          "feedback": "Incorrect! This graph may look similar to the data over the month because it rises and falls in a comparable way, but a sine function represents a repeating periodic pattern. That means it suggests the company’s profit would continue to move up and down in regular cycles. In this scenario, the fluctuation is connected to a recent strategy change, so a repeating sinusoidal model is less appropriate than a cubic model. The shape may look convincing locally, but the function type does not fit the situation as well."
        },
        {
          "id": "f4",
          "text": "\\(f(x)=-e^{0.17x}+100\\)",
          "correct": false,
          "feedback": "Incorrect! This function does not match the scatter plot because its shape is fundamentally different from the data. An exponential function like this changes in only one general direction and does not create the two turning points shown in the monthly profit pattern. The data decreases, then rises, and then decreases again, but this exponential model cannot capture that type of fluctuation. So the problem is not just a small mismatch in coefficients — the entire function family is not suitable for modeling this situation."
        }
      ]
    },
    {
      "id": "2",
      "label": "Analyse the company’s situation by finding its ▁▁▁▁.",
      "options": [
        {
          "id": "a1",
          "text": "critical points",
          "correct": true,
          "feedback": "Correct! Critical points help identify where profit changes direction and reaches local maximum or minimum values. That makes them the most useful features for analyzing this month’s fluctuation."
        },
        {
          "id": "a2",
          "text": "average rate of change over the month",
          "correct": false,
          "feedback": "Incorrect! The average rate of change only summarizes the overall change from the beginning to the end of the month. It does not show the important ups and downs within the month."
        },
        {
          "id": "a3",
          "text": "intercepts",
          "correct": false,
          "feedback": "Incorrect! Intercepts only show where the graph crosses the axes. They do not help identify the most important changes in the company’s profit pattern."
        }
      ]
    }
  ],
  "rubricOptions": [
    {
      "id": "derivative-correct",
      "label": "Derivative of the function is computed correctly",
      "correct": true,
      "feedback": "This is an essential criterion because a correct derivative is required to find critical points accurately."
    },
    {
      "id": "solve-fprime-zero",
      "label": "Equation \\(f'(x)=0\\) is solved correctly",
      "correct": true,
      "feedback": "This is an essential criterion because solving \\(f'(x)=0\\) correctly is necessary to identify all critical numbers."
    },
    {
      "id": "all-critical-points-identified",
      "label": "All critical points are correctly identified",
      "correct": true,
      "feedback": "This is an essential criterion because missing any critical point would lead to an incomplete or incorrect analysis."
    },
    {
      "id": "connects-critical-points-to-context",
      "label": "Correctly connects the critical points to important changes in the company’s profit during the month",
      "correct": true,
      "feedback": "This is an essential criterion because the goal is to identify and explain the day of highest profit."
    },
    {
      "id": "graph-verification",
      "label": "The behavior of the function is verified using a graph or visual inspection",
      "correct": false,
      "feedback": "This is not required, because visual checking may support the answer but does not determine its correctness."
    },
    {
      "id": "nearby-point-check",
      "label": "Values of the derivative are checked at nearby points to confirm the result",
      "correct": false,
      "feedback": "This is not required, since checking nearby values is optional and not needed to correctly solve the problem."
    }
  ],
  "sampleAnswers": {
    "correct": {
      "title": "Sample AI Answer 1 (100%)",
      "text": "\\(f(x)=-0.01x^3+0.45x^2-4x+80\\)\n\n\\(f'(x)=-0.03x^2+0.9x-4\\)\n\nSet \\(f'(x)=0\\):\n\\(-0.03x^2+0.9x-4=0\\)\n\n\\(3x^2-90x+400=0\\)\n\n\\(x=\\frac{90\\pm\\sqrt{3300}}{6}\\)\n\n\\(x\\approx 5.43,\\ 24.57\\)\n\nNow find the points:\n\n\\(f(5.43)\\approx 69.95\\)\n\n\\(f(24.57)\\approx 105.05\\)\n\nCritical points:\n\\((5.43,69.95),\\ (24.57,105.05)\\)\n\nInterpretation:\nAt \\(x\\approx 5.43\\), profit reaches a local minimum, so this is where the company’s profit stops decreasing and begins to rise.\nAt \\(x\\approx 24.57\\), profit reaches a local maximum, so this is where the profit stops increasing and begins to decrease again.\nThese points show the most important changes in the company’s profit pattern during the month."
    },
    "incorrect": {
      "title": "Sample AI Answer 2 (0%)",
      "text": "\\(f(x)=0.03x^2+0.9x-4\\)\n\n\\(f'(x)=0.06x+0.9\\)\n\nSet \\(f'(x)=0\\):\n\\(0.06x+0.9=0\\)\n\n\\(x=-15\\)\n\nCritical point:\n\\((-15,f(-15))\\)\n\nSo the company’s most important profit change happens before the month even begins, which means the model shows profit just keeps decreasing during the month."
    }
  },
  "finalAiAnswers": [
    {
      "id": "answer-50",
      "label": "AI Student 1",
      "steps": [
        "\\(f'(x)=-0.03x^2+0.9x-4\\)",
        "\\(-0.03x^2+0.9x-4=0\\)\n\n\\(3x^2-90x+400=0\\)\n\n\\(x=\\frac{90\\pm\\sqrt{3300}}{6}\\)\n\n\\(x\\approx 24.57\\)",
        "Critical point: \\(x\\approx 24.57\\)"
      ],
      "rubricFit": {
        "derivative-correct": {
          "pass": true,
          "step": 1,
          "feedback": "The derivative is computed correctly."
        },
        "solve-fprime-zero": {
          "pass": true,
          "step": 2,
          "feedback": "The equation f'(x)=0 is solved correctly."
        },
        "all-critical-points-identified": {
          "pass": false,
          "step": 3,
          "feedback": "Only one critical point is given. The second critical point is missing."
        },
        "connects-critical-points-to-context": {
          "pass": false,
          "step": 3,
          "feedback": "No interpretation is provided explaining what the critical point means for company profit."
        }
      }
    },
    {
      "id": "answer-25",
      "label": "AI Student 2",
      "steps": [
        "\\(f'(x)=-0.03x^2+0.9x-4\\)",
        "\\(-0.03x^2+0.9x-4=0\\)\n\n\\(3x^2-90x+400=0\\)\n\n\\((3x-30)(x-20)=0\\)",
        "\\(x=10,20\\)\n\nCritical points: \\(x=10,20\\)"
      ],
      "rubricFit": {
        "derivative-correct": {
          "pass": true,
          "step": 1,
          "feedback": "The derivative is computed correctly."
        },
        "solve-fprime-zero": {
          "pass": false,
          "step": 2,
          "feedback": "The factorization is incorrect, so f'(x)=0 is not solved correctly."
        },
        "all-critical-points-identified": {
          "pass": false,
          "step": 3,
          "feedback": "The critical values x=10 and x=20 are incorrect."
        },
        "connects-critical-points-to-context": {
          "pass": false,
          "step": 3,
          "feedback": "No interpretation connects the critical points to changes in company profit."
        }
      }
    }
  ]
}
