{
  "scenario": "A manufacturing company uses an automated monitoring system to review machine risk during an 8-hour shift. The system flagged the middle of the shift as a possible important point and suggested that the manager should inspect the machine around that time. Before changing the inspection schedule, the company wants to check whether the system’s claim is mathematically valid. The company collected risk-score data from the shift.",
  "question": "Use the function \\(R(t)=70+\\frac{8}{(t-4)^2}\\) to model the machine’s estimated risk score. The system marked t=4 as a critical point of the model. To check this claim, determine whether \\(R(4)\\) exists and \\(R'(4)=0\\) or \\(R'(4)\\) does not exist.",
  "plotDataSrc": "/data/scenarios/3/plot-data.json",
  "questionParts": [
    {
      "id": "1",
      "label": "Use the function ▁▁▁▁ to model the machine’s estimated risk score.",
      "options": [
        {
          "id": "f1",
          "text": "\\(R(t)=70+\\frac{8}{(t-4)^2}\\)",
          "correct": true,
          "feedback": "Correct! This function best matches the overall pattern of the scatter plot, where the risk score becomes much higher near the middle of the shift and lower farther away from that time. The denominator approaches zero near \\(t=4\\), which creates the sharp increase shown in the data."
        },
        {
          "id": "f2",
          "text": "\\(R(t)=90-(t-4)^2\\)",
          "correct": false,
          "feedback": "Incorrect! This function creates a smooth rounded peak near the middle of the shift, but the scatter plot suggests the values rise much more sharply near \\(t=4\\). The overall shape does not match the steep increase shown in the data."
        },
        {
          "id": "f3",
          "text": "\\(R(t)=2t+70\\)",
          "correct": false,
          "feedback": "Incorrect! This function only increases over time, but the scatter plot does not show one consistent increasing trend across the whole shift. The risk score rises sharply near the middle and then decreases afterward."
        },
        {
          "id": "f4",
          "text": "\\(R(t)=70+2e^{0.3t}\\)",
          "correct": false,
          "feedback": "Incorrect! This function increases exponentially in one direction, but it does not match the pattern of high values near the middle of the shift and lower values farther away. The graph does not capture the sharp behavior around \\(t=4\\)."
        }
      ]
    },
    {
      "id": "2",
      "label": "The system marked t=4 as a critical point of the model. To check this claim, determine whether ▁▁▁▁.",
      "options": [
        {
          "id": "c1",
          "text": "\\(R(4)\\) exists and \\(R'(4)=0\\) or \\(R'(4)\\) does not exist",
          "correct": true,
          "feedback": "Correct! To determine whether \\(t=4\\) is a critical point, the function value must exist and the derivative must either equal zero or be undefined."
        },
        {
          "id": "c2",
          "text": "\\(R'(4)\\) does not exist",
          "correct": false,
          "feedback": "Incorrect! This is not enough by itself. A critical point also requires the original function value to exist at that input."
        },
        {
          "id": "c3",
          "text": "\\(R(t)\\) becomes very large near \\(t=4\\)",
          "correct": false,
          "feedback": "Incorrect! Large nearby values do not prove that \\(t=4\\) is a critical point. The function itself must exist at that point."
        },
        {
          "id": "c4",
          "text": "\\(R(0)=R(8)\\)",
          "correct": false,
          "feedback": "Incorrect! Equal endpoint values do not determine whether \\(t=4\\) is a critical point."
        }
      ]
    }
  ],
  "rubricOptions": [
    {
      "id": "checks-r4-exists",
      "label": "Checks whether \\(R(4)\\) exists",
      "correct": true,
      "feedback": "This is an essential criterion because a critical point must belong to the original function. The answer must check whether the model gives a valid value at \\(t=4\\)."
    },
    {
      "id": "identifies-r4-undefined",
      "label": "Correctly identifies that \\(R(4)\\) is undefined",
      "correct": true,
      "feedback": "This is an essential criterion because the denominator becomes zero at \\(t=4\\), making the function undefined."
    },
    {
      "id": "applies-critical-point-definition",
      "label": "Correctly applies the full definition of a critical point",
      "correct": true,
      "feedback": "This is an essential criterion because an undefined derivative alone is not sufficient. The function value must also exist."
    },
    {
      "id": "concludes-not-critical",
      "label": "Correctly concludes that \\(t=4\\) is not a critical point",
      "correct": true,
      "feedback": "This is an essential criterion because the system’s claim is incorrect. Since \\(R(4)\\) does not exist, \\(t=4\\) cannot be a critical point."
    },
    {
      "id": "solves-derivative-zero",
      "label": "Solves \\(R'(t)=0\\) to search for possible critical numbers",
      "correct": false,
      "feedback": "This is not sufficient for this problem. While solving \\(R'(t)=0\\) is part of finding critical numbers in general, the key issue here is whether the function exists at \\(t=4\\)."
    },
    {
      "id": "compares-nearby-values",
      "label": "Compares nearby risk scores before and after \\(t=4\\)",
      "correct": false,
      "feedback": "This is not required. Nearby behavior may help visualize the model, but it does not determine whether \\(t=4\\) is a valid critical point."
    }
  ],
  "sampleAnswers": {
    "correct": {
      "title": "Sample AI Answer 1 (100%)",
      "text": "\\(R(t)=70+\\frac{8}{(t-4)^2}\\)\n\nTo determine whether \\(t=4\\) is a critical point, first check whether \\(R(4)\\) exists.\n\n\\(R(4)=70+\\frac{8}{(4-4)^2}\\)\n\n\\(R(4)=70+\\frac{8}{0}\\)\n\nDivision by zero is undefined, so \\(R(4)\\) does not exist.\n\nA critical point must satisfy two conditions:\n- the function value exists\n- and the derivative is zero or undefined\n\nSince \\(R(4)\\) does not exist, \\(t=4\\) is not a critical point.\n\nTherefore, the monitoring system’s claim is not mathematically valid."
    },
    "incorrect": {
      "title": "Sample AI Answer 2 (0%)",
      "text": "\\(R(t)=70+\\frac{8}{(t-4)^2}\\)\n\nAs \\(t\\) approaches 4, the denominator becomes very small, so the graph rises sharply.\n\nBecause the graph becomes very large near \\(t=4\\), this means \\(t=4\\) is a critical point.\n\nTherefore, the system is correct."
    }
  },
  "finalAiAnswers": [
    {
      "id": "answer-50",
      "label": "AI Student 1",
      "steps": [
        "To check whether \\(t=4\\) is a critical point, we examine the function.\n\n\\(R(4)=70+\\frac{8}{(4-4)^2}\\)",
        "The denominator becomes zero, so \\(R(4)\\) is undefined.",
        "Also, the derivative is undefined near \\(t=4\\), so this means \\(t=4\\) is a critical point."
      ],
      "rubricFit": {
        "checks-r4-exists": {
          "pass": true,
          "step": 1,
          "feedback": "The answer correctly checks whether \\(R(4)\\) exists."
        },
        "identifies-r4-undefined": {
          "pass": true,
          "step": 2,
          "feedback": "The answer correctly identifies that \\(R(4)\\) is undefined."
        },
        "applies-critical-point-definition": {
          "pass": false,
          "step": 3,
          "feedback": "The answer does not correctly apply the full definition of a critical point. Since \\(R(4)\\) does not exist, \\(t=4\\) cannot be a critical point."
        },
        "concludes-not-critical": {
          "pass": false,
          "step": 3,
          "feedback": "The answer incorrectly concludes that \\(t=4\\) is a critical point."
        }
      }
    },
    {
      "id": "answer-25",
      "label": "AI Student 2",
      "steps": [
        "The graph gets very high near \\(t=4\\), which means the machine risk is highest there.",
        "Since the graph changes direction around \\(t=4\\), that must be a critical point.",
        "Therefore, the system’s claim is correct."
      ],
      "rubricFit": {
        "checks-r4-exists": {
          "pass": true,
          "step": 1,
          "feedback": "The answer correctly check whether \\(R(4)\\) exists, which is necessary for determining whether \\(t=4\\) is a critical point."
        },
        "identifies-r4-undefined": {
          "pass": false,
          "step": 1,
          "feedback": "The answer does not identify that \\(R(4)\\) is undefined, which is a key reason why \\(t=4\\) cannot be a critical point."
        },
        "applies-critical-point-definition": {
          "pass": false,
          "step": 2,
          "feedback": "The answer does not correctly apply the full definition of a critical point. The function value must exist at \\(t=4\\) for it to be a critical point."
        },
        "concludes-not-critical": {
          "pass": false,
          "step": 2,
          "feedback": "It incorrectly concludes that \\(t=4\\) is a critical point."
        }
      }
    }
  ]
}
