{
  "scenario": "During a heavy rainstorm, water flows into a city reservoir. The rate of water flow into the reservoir is modeled in thousands of gallons per hour, where t is the number of hours since the storm began. The reservoir has a maximum capacity of 500 thousand gallons, and at the start of the storm, it already contains 450 thousand gallons. The city engineers need to determine whether the reservoir will overflow during the first 4 hours of the storm.",
  "question": "Use the function \\(R(t)=20+5t-1/2t^2\\) to model the reservoir inflow rate. To determine how much additional water enters the reservoir during the first 4 hours, apply integration, and determine if the reservoir will overflow or not.",
  "plotDataSrc": "/data/scenarios/2/plot-data.json",
  "questionParts": [
    {
      "id": "1",
      "label": "Use the function ▁▁▁▁ to model the reservoir inflow rate.",
      "options": [
        {
          "id": "f1",
          "text": "\\(R(t)=20+5t-1/2t^2\\)",
          "correct": true,
          "feedback": "Correct! This function matches the reservoir inflow model in the scenario. It starts at 20 thousand gallons per hour, increases during the early storm, and then bends downward because of the negative quadratic term."
        },
        {
          "id": "f2",
          "text": "\\(R(t)=20+4t-1/2t^2\\)",
          "correct": false,
          "feedback": "Incorrect! This function changes the linear coefficient from 5 to 4, so the inflow rate increases too slowly compared with the model in the scenario."
        },
        {
          "id": "f3",
          "text": "\\(R(t)=18+5t-1/2t^2\\)",
          "correct": false,
          "feedback": "Incorrect! This function changes the initial inflow rate from 20 to 18 thousand gallons per hour, so it does not match the scenario."
        },
        {
          "id": "f4",
          "text": "\\(R(t)=20+5t-t^2\\)",
          "correct": false,
          "feedback": "Incorrect! This function changes the quadratic coefficient from -0.5 to -1, making the rate bend downward too sharply."
        }
      ]
    },
    {
      "id": "2",
      "label": "To determine how much additional water enters the reservoir during the first 4 hours, apply ▁▁▁▁, and determine if the reservoir will overflow or not.",
      "options": [
        {
          "id": "op1",
          "text": "integration",
          "correct": true,
          "feedback": "Correct! Since \\(R(t)\\) is a rate of water flow, integration over \\([0,4]\\) gives the accumulated amount of water that entered the reservoir."
        },
        {
          "id": "op2",
          "text": "differentiation",
          "correct": false,
          "feedback": "Incorrect! Differentiation would describe how the inflow rate itself is changing, which is useful for finding the peak flow rate, but not for finding total accumulated water."
        },
        {
          "id": "op3",
          "text": "finding an intercept",
          "correct": false,
          "feedback": "Incorrect! Intercepts show when a function equals zero. The goal here is to find total water added over time, so an accumulation method is needed."
        },
        {
          "id": "op4",
          "text": "finding an average rate of change",
          "correct": false,
          "feedback": "Incorrect! Average rate of change compares the inflow rate at two times. It does not calculate the total amount of water entering the reservoir."
        }
      ]
    }
  ],
  "rubricOptions": [
    {
      "id": "identifies-integration",
      "label": "Correctly identifies integration as the needed operation for accumulated water",
      "correct": true,
      "feedback": "This is an essential criterion because the task asks for total water added from a rate over a time interval."
    },
    {
      "id": "sets-integral-bounds",
      "label": "Sets up the definite integral \\(\\int_{0}^{4} R(t)\\,dt\\) with correct bounds",
      "correct": true,
      "feedback": "This is an essential criterion because the accumulated water must be calculated over the first 4 hours of the storm."
    },
    {
      "id": "computes-antiderivative",
      "label": "Computes the antiderivative of \\(20+5t-\\frac{1}{2}t^2\\) correctly",
      "correct": true,
      "feedback": "This is an essential criterion because an incorrect antiderivative leads to an incorrect accumulated amount."
    },
    {
      "id": "finds-peak-rate",
      "label": "Finds the time when the inflow rate is maximized",
      "correct": false,
      "feedback": "This is not required for Goal A. It is relevant to Goal B, but Goal A asks for accumulated water during the first 4 hours."
    },
    {
      "id": "uses-graph-only",
      "label": "Uses the graph or scatter plot alone to estimate the answer",
      "correct": false,
      "feedback": "This is not sufficient because the task asks for a calculus-based calculation of accumulated water, not only a visual estimate."
    }
  ],
  "sampleAnswers": {
    "correct": {
      "title": "Sample AI Answer 1 (100%)",
      "text": "Because \\(R(t)\\) is measured in thousands of gallons per hour, I need integration to find the total amount of water that enters during the first 4 hours.\n\n\\(\\int_{0}^{4}\\left(20+5t-\\frac{1}{2}t^2\\right)dt\\)\n\n\\(=\\left[20t+\\frac{5}{2}t^2-\\frac{1}{6}t^3\\right]_{0}^{4}\\)\n\n\\(=80+40-\\frac{64}{6}\\)\n\n\\(\\approx109.33\\)\n\nSo about 109.33 thousand gallons enter the reservoir during the first 4 hours.\n\nThe reservoir started with 450 thousand gallons, so the total is:\n\n\\(450+109.33=559.33\\)\n\nSince \\(559.33>500\\), the reservoir will overflow."
    },
    "incorrect": {
      "title": "Sample AI Answer 2 (0%)",
      "text": "I need to differentiate because the problem gives a function involving time.\n\n\\(R'(t)=5-t\\)\n\nAt \\(t=4\\):\n\n\\(R'(4)=1\\)\n\nSo 1 thousand gallons entered the reservoir during the first 4 hours.\n\nThe reservoir has \\(450+1=451\\) thousand gallons, so it will not overflow."
    }
  },
  "finalAiAnswers": [
    {
      "id": "answer-50",
      "label": "Alex",
      "steps": [
        "Since \\(R(t)\\) is a rate, I should integrate it from 0 to 4.",
        "\\(\\int_{0}^{4}\\left(20+5t-\\frac{1}{2}t^2\\right)dt\\)",
        "\\(=\\left[20t+5t^2-\\frac{1}{2}t^3\\right]_{0}^{4}\\)\n\n\\(=80+80-32\\)\n\n\\(=128\\)",
        "So 128 thousand gallons enter the reservoir. Since \\(450+128=578\\), the reservoir will overflow."
      ],
      "rubricFit": {
        "identifies-integration": {
          "pass": true,
          "step": 1,
          "feedback": "The answer correctly identifies integration as the needed operation for accumulated water."
        },
        "sets-integral-bounds": {
          "pass": true,
          "step": 2,
          "feedback": "The answer sets up the definite integral with correct bounds from 0 to 4."
        },
        "computes-antiderivative": {
          "pass": false,
          "step": 3,
          "feedback": "The antiderivative is computed incorrectly, leading to an incorrect accumulated water value."
        }
      }
    },
    {
      "id": "answer-25",
      "label": "Bea",
      "steps": [
        "To find the amount of water added, I will use the rate at 4 hours.",
        "\\(R(4)=20+5(4)-\\frac{1}{2}(4)^2\\)\n\n\\(R(4)=32\\)",
        "So 32 thousand gallons enter the reservoir during the first 4 hours.\n\n\\(450+32=482\\)\n\nSince \\(482<500\\), the reservoir will not overflow."
      ],
      "rubricFit": {
        "identifies-integration": {
          "pass": false,
          "step": 1,
          "feedback": "This answer evaluates the rate at one time instead of integrating over the interval, so it confuses instantaneous rate with accumulated water."
        },
        "sets-integral-bounds": {
          "pass": false,
          "step": 2,
          "feedback": "The answer does not set up a definite integral, which is needed to calculate total water added over the time interval."
        },
        "computes-antiderivative": {
          "pass": false,
          "step": 2,
          "feedback": "The answer does not compute an antiderivative because it does not use integration."
        }
      }
    }
  ]
}
